accession	action	sdrf_path	title	evidence_terms	pride_queries	organisms	organism_parts	diseases	instruments	experiment_types	quantification_methods	file_count	draft_row_count	pride_pubmed_ids	pride_dois	europepmc_hit_count	europepmc_first_pmid	europepmc_first_doi	europepmc_first_title	pride_url
PXD045844	sandbox_draft	sandbox/PXD045844/PXD045844.sdrf.tsv	Sex Differences in Single Neuron Function and Proteomics Profiles Examined by Patch-Clamp and Mass Spectrometry in the Locus Coeruleus of the Adult Mouse	single-cell proteomics	single cell proteomics;single-cell proteomic;single-cell proteomics	Mus musculus (mouse)	Neuron; Brain		Orbitrap Eclipse	Shotgun proteomics	Label free	19	9	38459766	10.1111/apha.14123	2	38459766	10.1111/apha.14123	Sex differences in single neuron function and proteomics profiles examined by patch-clamp and mass spectrometry in the locus coeruleus of the adult mouse.	https://www.ebi.ac.uk/pride/archive/projects/PXD045844
PXD046211	sandbox_draft	sandbox/PXD046211/PXD046211.sdrf.tsv	Benchmarking of single cell proteomics data analysis workflows	single-cell proteomics;SCoPE-MS	SCoPE2;single cell proteomics;single-cell proteomic;single-cell proteomics	Homo sapiens (human)	Cell culture; Monocyte	Lymphoma; Acute leukemia	Orbitrap Fusion Lumos; Orbitrap Exploris 240; timsTOF SCP	Shotgun proteomics	TMT	130	106		10.48550/ARXIV.2310.13598	0				https://www.ebi.ac.uk/pride/archive/projects/PXD046211
PXD046354	sandbox_draft	sandbox/PXD046354/PXD046354.sdrf.tsv	Deep Visual Proteomics and spatial transcriptomics reveal the landscape of tumor malignancy in borderline ovarian cancer	deep visual proteomics	Deep Visual Proteomics	Homo sapiens (human)	Epithelial cell; Ovary cancer cell; Ovarian low malignant potential tumor cell; Stromal cell	Ovarian cancer	timsTOF SCP	Bottom-up proteomics	Label free	7	1			0				https://www.ebi.ac.uk/pride/archive/projects/PXD046354
PXD046467	sandbox_draft	sandbox/PXD046467/PXD046467.sdrf.tsv	The 15-min Subcellular Proteome	single-cell proteomics;single-cell proteome	single cell proteome;single cell proteomics;single-cell proteome;single-cell proteomic;single-cell proteomics	Homo sapiens (human); Xenopus laevis (african clawed frog)	Embryo		Q Exactive	Bottom-up proteomics		100	83		10.1021/ACS.JPROTEOME.4C00491	1	39325989	10.1021/acs.jproteome.4c00491	Data-Independent Acquisition Shortens the Analytical Window of Single-Cell Proteomics to Fifteen Minutes in Capillary Electrophoresis Mass Spectrometry.	https://www.ebi.ac.uk/pride/archive/projects/PXD046467
PXD046999	sandbox_draft	sandbox/PXD046999/PXD046999.sdrf.tsv	Spatial characterization and stratification of colorectal adenomas by Deep Visual Proteomics	deep visual proteomics	Deep Visual Proteomics	Homo sapiens (human)	Epithelial cell; Colon; Cell culture; Stromal cell	Colorectal adenoma	timsTOF SCP	Data-independent acquisition; Bottom-up proteomics; Data-dependent acquisition	Label free; Data-dependent acquisition; diaPASEF	34	1			1	39252972	10.1016/j.isci.2024.110620	Spatial characterization and stratification of colorectal adenomas by deep visual proteomics.	https://www.ebi.ac.uk/pride/archive/projects/PXD046999
PXD047627	sandbox_draft	sandbox/PXD047627/PXD047627.sdrf.tsv	Solid phase microextraction-aided capillary zone electrophoresis-mass spectrometry: ready for bottom-up proteomics of single human cells	single-cell proteomics	single cell proteomics;single-cell proteomic;single-cell proteomics	Homo sapiens (human)	Hela cell		Q Exactive HF	Bottom-up proteomics		17	8	38514245	10.1021/jasms.3c00429	1	38514245	10.1021/jasms.3c00429	Solid-Phase Microextraction-Aided Capillary Zone Electrophoresis-Mass Spectrometry: Toward Bottom-Up Proteomics of Single Human Cells.	https://www.ebi.ac.uk/pride/archive/projects/PXD047627
PXD048052	sandbox_draft	sandbox/PXD048052/PXD048052.sdrf.tsv	A zwitterionic detergent and catalyst-based single-cell proteomics using a loss-free microhole-collection disc	single-cell proteomics	single cell proteomics;single-cell proteomic;single-cell proteomics	Homo sapiens (human)	Permanent cell line cell; Cell culture		Q Exactive HF	Shotgun proteomics	TMT	330	326	38991018	10.1021/acs.analchem.4c00158	0				https://www.ebi.ac.uk/pride/archive/projects/PXD048052
PXD048162	sandbox_draft	sandbox/PXD048162/PXD048162.sdrf.tsv	Enhanced feature matching in single-cell proteomics characterizes response to IFN- and reveals co-existence of different cell states-Bulk Proteomics experiment	single-cell proteomics	single cell proteomics;single-cell proteomic;single-cell proteomics	Homo sapiens (human)	Epithelial cell	Osteosarcoma	Orbitrap Fusion	Bottom-up proteomics; Data-dependent acquisition	MS1 intensity based label-free quantification method	19	15			1	39327420	10.1038/s41467-024-52605-x	Enhanced feature matching in single-cell proteomics characterizes IFN- response and co-existence of cell states.	https://www.ebi.ac.uk/pride/archive/projects/PXD048162
PXD048179	sandbox_draft	sandbox/PXD048179/PXD048179.sdrf.tsv	Enhanced feature matching in single-cell proteomics characterizes response to IFN- and reveals co-existence of different cell states-single cell Proteomics experiment	single-cell proteomics	single cell proteomics;single-cell proteomic;single-cell proteomics	Homo sapiens (human)	Epithelial cell	Osteosarcoma	timsTOF Pro	Data-independent acquisition; Bottom-up proteomics	Label free	161	159			0				https://www.ebi.ac.uk/pride/archive/projects/PXD048179
PXD048347	sandbox_draft	sandbox/PXD048347/PXD048347.sdrf.tsv	Deciphering lineage specification during early embryogenesis using multi-layered proteomics	single-cell proteomics;cellenONE;ProteoCHIP	single cell proteomics;single-cell proteomic;single-cell proteomics	Mus musculus (mouse)			Orbitrap Eclipse	Bottom-up proteomics	TMT	30	28		10.1016/J.STEM.2024.04.017	0				https://www.ebi.ac.uk/pride/archive/projects/PXD048347
PXD048565	sandbox_draft	sandbox/PXD048565/PXD048565.sdrf.tsv	Open-Tubular Trap Columns: Towards Simple and Robust Liquid Chromatography Separations for Single-Cell Proteomics	single-cell proteomics	single cell proteomics;single-cell proteomic;single-cell proteomics	Homo sapiens (human)			Orbitrap Exploris 480	Bottom-up proteomics		72	58		10.1039/D3MO00249G	1	38353725	10.1039/d3mo00249g	Open-tubular trap columns: towards simple and robust liquid chromatography separations for single-cell proteomics.	https://www.ebi.ac.uk/pride/archive/projects/PXD048565
PXD048926	sandbox_draft	sandbox/PXD048926/PXD048926.sdrf.tsv	Increasing Proteome Coverage Through a Reduction in Analyte Complexity and Its Applications for Single-Cell Proteomics	single-cell proteomics	single cell proteomics;single-cell proteomic;single-cell proteomics	Homo sapiens (human)	Epithelial cell; Uterine cervix; Cell culture		Orbitrap Exploris 480	Shotgun proteomics; Bottom-up proteomics		187	144		10.1021/ACS.JPROTEOME.4C00062	1	38832920	10.1021/acs.jproteome.4c00062	Increasing Proteome Coverage Through a Reduction in Analyte Complexity in Single-Cell Equivalent Samples.	https://www.ebi.ac.uk/pride/archive/projects/PXD048926
PXD049181	sandbox_draft	sandbox/PXD049181/PXD049181.sdrf.tsv	Deep single-cell proteomics quantifies low-abundant embryonic transcription factors and lineage markers during induced pluripotent stem cell differentiation	single-cell proteomics;cellenONE;ProteoCHIP	single cell proteomics;single-cell proteomic;single-cell proteomics	Homo sapiens (human)	Cell culture		Orbitrap Astral	Data-independent acquisition		115	111			1	39820750	10.1038/s41592-024-02558-2	Enhanced sensitivity and scalability with a Chip-Tip workflow enables deep single-cell proteomics.	https://www.ebi.ac.uk/pride/archive/projects/PXD049181
PXD049211	sandbox_draft	sandbox/PXD049211/PXD049211.sdrf.tsv	Deep single-cell proteomics quantifies low-abundant embryonic transcription factors and lineage markers during induced pluripotent stem cell differentiation	single-cell proteomics;cellenONE;ProteoCHIP	single cell proteomics;single-cell proteomic;single-cell proteomics	Homo sapiens (human)	Cell culture		Orbitrap Astral	Data-independent acquisition		205	188			1	39820750	10.1038/s41592-024-02558-2	Enhanced sensitivity and scalability with a Chip-Tip workflow enables deep single-cell proteomics.	https://www.ebi.ac.uk/pride/archive/projects/PXD049211
PXD049248	sandbox_draft	sandbox/PXD049248/PXD049248.sdrf.tsv	Multicolumn Nanoflow Liquid Chromatography System with Accelerated Offline Gradient Generation for Robust and Sensitive Single-Cell Proteome Profiling	single-cell proteomics;single-cell proteome;cellenONE	single cell proteome;single cell proteomics;single-cell proteome;single-cell proteomic;single-cell proteomics	Homo sapiens (human)	Epithelial cell	Cervix carcinoma	Orbitrap Exploris 480	Bottom-up proteomics	TIC	21	15	38915247	10.1021/acs.analchem.4c00878	1	38915247	10.1021/acs.analchem.4c00878	Multicolumn Nanoflow Liquid Chromatography with Accelerated Offline Gradient Generation for Robust and Sensitive Single-Cell Proteome Profiling.	https://www.ebi.ac.uk/pride/archive/projects/PXD049248
PXD049412	sandbox_draft	sandbox/PXD049412/PXD049412.sdrf.tsv	Challenging the Astral mass analyzer  up to 5300 proteins per single-cell at unseen quantitative accuracy to study cellular heterogeneity.	single-cell proteomics;cellenONE	single cell proteomics;single-cell proteomic;single-cell proteomics	Saccharomyces cerevisiae (baker's yeast); Homo sapiens (human)	Epithelial cell; Stem cell	Lung cancer	Orbitrap Astral; Orbitrap Exploris 480	Data-independent acquisition; Bottom-up proteomics	MS1 intensity based label-free quantification method	635	357		10.1038/S41592-024-02559-1	2	39820751	10.1038/s41592-024-02559-1	Challenging the Astral mass analyzer to quantify up to 5,300 proteins per single cell at unseen accuracy to uncover cellular heterogeneity.	https://www.ebi.ac.uk/pride/archive/projects/PXD049412
PXD051795	sandbox_draft	sandbox/PXD051795/PXD051795.sdrf.tsv	Single-cell-type Spatial Proteomics Unveils Precision Medicine Insights in Composite Small Lymphocytic and Classical Hodgkin Lymphoma	single-cell proteomics;deep visual proteomics	Deep Visual Proteomics;single cell proteomics;single-cell proteomic;single-cell proteomics	Homo sapiens (human)	Lymph node; B cell	Lymphoma	timsTOF Pro	Data-independent acquisition; Data-dependent acquisition	Label free	5	1			0				https://www.ebi.ac.uk/pride/archive/projects/PXD051795
PXD051942	sandbox_draft	sandbox/PXD051942/PXD051942.sdrf.tsv	Global analysis of protein turnover dynamics in single cells	single-cell proteomics	single cell proteomics;single-cell proteomic;single-cell proteomics	Homo sapiens (human)	Cell culture		Orbitrap Astral	Bottom-up proteomics		1393	1376			0				https://www.ebi.ac.uk/pride/archive/projects/PXD051942
PXD052341	sandbox_draft	sandbox/PXD052341/PXD052341.sdrf.tsv	Deep Visual Proteomics advances human colon organoid  models by revealing a switch to an in vivo-like phenotype upon xenotransplantation	deep visual proteomics	Deep Visual Proteomics	Homo sapiens (human)	Epithelial cell; Colon		Orbitrap Astral	Data-independent acquisition; Bottom-up proteomics	Label free	11	5			0				https://www.ebi.ac.uk/pride/archive/projects/PXD052341
PXD052416	sandbox_draft	sandbox/PXD052416/PXD052416.sdrf.tsv	Chromatography without a Binary Pump: Smoothed Step Gradients Enable Reproducible, Sensitive, and Low-Cost Nanoflow Separations	single-cell proteomics;single-cell proteome	single cell proteome;single cell proteomics;single-cell proteome;single-cell proteomic;single-cell proteomics	Homo sapiens (human)			timsTOF Ultra	Bottom-up proteomics		153	1	39536954	10.1016/j.mcpro.2024.100880	1	39536954	10.1016/j.mcpro.2024.100880	Gradient-Elution Nanoflow Liquid Chromatography Without a Binary Pump: Smoothed Step Gradients Enable Reproducible, Sensitive, and Low-Cost Separations for Single-Cell Proteomics.	https://www.ebi.ac.uk/pride/archive/projects/PXD052416
PXD053023	sandbox_draft	sandbox/PXD053023/PXD053023.sdrf.tsv	Electrophoresis-Correlative Framing of Ion Mobility Deepens Single-Cell Mass Spectrometry Proteomics	single-cell proteome;single-cell mass spectrometry	single cell mass spectrometry;single cell proteome;single-cell mass spectrometry;single-cell proteome	Homo sapiens (human); Xenopus laevis (african clawed frog)	Cell culture		timsTOF	Bottom-up proteomics; Data-dependent acquisition		8	2		10.1016/J.MCPRO.2024.100892	0				https://www.ebi.ac.uk/pride/archive/projects/PXD053023
PXD053053	sandbox_draft	sandbox/PXD053053/PXD053053.sdrf.tsv	Multiplexed single cell proteomics of hypoxia in HEK293 expressing PIP-FUCCI	single-cell proteomics;single-cell mass spectrometry;SCoPE-MS	SCoPE2;single cell mass spectrometry;single cell proteomics;single-cell mass spectrometry;single-cell proteomic;single-cell proteomics	Homo sapiens (human)			Orbitrap Eclipse	Bottom-up proteomics; Data-dependent acquisition		109	96	41317903	10.1016/j.mcpro.2025.101475	1	41317903	10.1016/j.mcpro.2025.101475	Resolving Single-Cell Gene Expression by Pseudotemporal Integration of Transcriptomic and Proteomic Datasets.	https://www.ebi.ac.uk/pride/archive/projects/PXD053053
PXD053079	sandbox_draft	sandbox/PXD053079/PXD053079.sdrf.tsv	Deep Visual Proteomics reveals DNA replication stress as a hallmark of Signet Ring Cell Carcinoma	deep visual proteomics	Deep Visual Proteomics	Homo sapiens (human)	Lymph node; Urinary bladder; Malignant cell; Prostate cancer cell; Seminal vesicle	Signet ring cell adenocarcinoma	Orbitrap Astral	Bottom-up proteomics; diaPASEF	Label free	10	3	39910169	10.1038/s41698-025-00819-7	1	39910169	10.1038/s41698-025-00819-7	Deep visual proteomics reveals DNA replication stress as a hallmark of signet ring cell carcinoma.	https://www.ebi.ac.uk/pride/archive/projects/PXD053079
PXD053450	sandbox_draft	sandbox/PXD053450/PXD053450.sdrf.tsv	A carrier-based quantitative proteomics method applied to biomarker discovery in pericardial fluid	single-cell proteomics;carrier proteome SCP	single cell proteomics;single-cell proteomic;single-cell proteomics	Homo sapiens (human)	Myocardium; Pericardial fluid; Pericardium; Heart	Type 2 diabetes mellitus; Heart failure	Orbitrap Exploris 480	Bottom-up proteomics; Data-dependent acquisition	TMT	203	155	39004188	10.1016/j.mcpro.2024.100812	1	39004188	10.1016/j.mcpro.2024.100812	A Carrier-Based Quantitative Proteomics Method Applied to Biomarker Discovery in Pericardial Fluid.	https://www.ebi.ac.uk/pride/archive/projects/PXD053450
PXD053462	sandbox_draft	sandbox/PXD053462/PXD053462.sdrf.tsv	Enhanced feature matching in single-cell proteomics characterizes response to IFN- and reveals co-existence of different cell states- E.coli spike benchmark Proteomics experiment_Vendor Files	single-cell proteomics	single cell proteomics;single-cell proteomic;single-cell proteomics	Homo sapiens (human)	Epithelial cell; Cell culture	Cervix carcinoma	timsTOF Pro 2	Data-independent acquisition; Bottom-up proteomics; diaPASEF	Spectrum counting; Peptide counting	58	1			1	39327420	10.1038/s41467-024-52605-x	Enhanced feature matching in single-cell proteomics characterizes IFN- response and co-existence of cell states.	https://www.ebi.ac.uk/pride/archive/projects/PXD053462
PXD053464	sandbox_draft	sandbox/PXD053464/PXD053464.sdrf.tsv	Enhanced feature matching in single-cell proteomics characterizes response to IFN- and reveals co-existence of different cell states-single cell Proteomics experiment Vendor Files	single-cell proteomics	single cell proteomics;single-cell proteomic;single-cell proteomics	Homo sapiens (human)	Bone cell	Osteosarcoma	timsTOF Pro 2	Data-independent acquisition; Bottom-up proteomics; diaPASEF	Spectrum counting; Peptide counting	204	1			1	39327420	10.1038/s41467-024-52605-x	Enhanced feature matching in single-cell proteomics characterizes IFN- response and co-existence of cell states.	https://www.ebi.ac.uk/pride/archive/projects/PXD053464
PXD053473	sandbox_draft	sandbox/PXD053473/PXD053473.sdrf.tsv	Enhanced feature matching in single-cell proteomics characterizes response to IFN- and reveals co-existence of different cell states - IFNy-200pg Vendor files	single-cell proteomics	single cell proteomics;single-cell proteomic;single-cell proteomics	Homo sapiens (human)	Bone cell	Osteosarcoma	timsTOF Pro 2	Data-independent acquisition; Bottom-up proteomics; diaPASEF	Spectrum counting; Peptide counting	104	1			1	39327420	10.1038/s41467-024-52605-x	Enhanced feature matching in single-cell proteomics characterizes IFN- response and co-existence of cell states.	https://www.ebi.ac.uk/pride/archive/projects/PXD053473
PXD054066	sandbox_draft	sandbox/PXD054066/PXD054066.sdrf.tsv	Deep single-cell proteomics quantifies low-abundant embryonic transcription factors and lineage markers during induced pluripotent stem cell differentiation	single-cell proteomics;cellenONE;ProteoCHIP	single cell proteomics;single-cell proteomic;single-cell proteomics	Homo sapiens (human)	Cell culture		Orbitrap Astral	Bottom-up proteomics		128	123			0				https://www.ebi.ac.uk/pride/archive/projects/PXD054066
PXD054083	sandbox_draft	sandbox/PXD054083/PXD054083.sdrf.tsv	Global analysis of protein turnover dynamics in single cells	single-cell proteomics	single cell proteomics;single-cell proteomic;single-cell proteomics	Homo sapiens (human)	Cell culture		Orbitrap Astral	Bottom-up proteomics		201	186			0				https://www.ebi.ac.uk/pride/archive/projects/PXD054083
PXD054440	sandbox_draft	sandbox/PXD054440/PXD054440.sdrf.tsv	The proteomic landscape of proteotoxic stress in a fibrogenic liver disease	deep visual proteomics	Deep Visual Proteomics	Homo sapiens (human)	Liver; Hepatocyte	Alpha 1-antitrypsin deficiency	Orbitrap Astral	Data-independent acquisition; Bottom-up proteomics		8	1			1	40240610	10.1038/s41586-025-08885-4	Deep Visual Proteomics maps proteotoxicity in a genetic liver disease.	https://www.ebi.ac.uk/pride/archive/projects/PXD054440
PXD054445	sandbox_draft	sandbox/PXD054445/PXD054445.sdrf.tsv	Formaldehyde fixation helps preserving proteome state during single-cell proteomics sample processing and analysis	single-cell proteomics;cellenONE	single cell proteomics;single-cell proteomic;single-cell proteomics	Homo sapiens (human)	Cell culture		Orbitrap Astral	Bottom-up proteomics		161	142			1	39901769	10.1021/acs.jproteome.4c00656	Formaldehyde Fixation Helps Preserve the Proteome State during Single-Cell Proteomics Sample Processing and Analysis.	https://www.ebi.ac.uk/pride/archive/projects/PXD054445
PXD055869	sandbox_draft	sandbox/PXD055869/PXD055869.sdrf.tsv	Establishment of Salivary Tissue-Organoid Biorepository	single-cell proteomics;cellenONE	single cell proteomics;single-cell proteomic;single-cell proteomics	Homo sapiens (human)	Saliva		timsTOF SCP	Data-independent acquisition; Bottom-up proteomics		5	1	40399315	10.1038/s41536-025-00410-5	1	40399315	10.1038/s41536-025-00410-5	Establishment of salivary tissue-organoid biorepository: characterizing salivary gland stem/progenitor cells and novel differentiation marker PSMA/FOLH1.	https://www.ebi.ac.uk/pride/archive/projects/PXD055869
PXD055915	sandbox_draft	sandbox/PXD055915/PXD055915.sdrf.tsv	msSIM for single-cell proteomic analysis	single-cell proteomics	single cell proteomics;single-cell proteomic;single-cell proteomics	Homo sapiens (human)	Epithelial cell; Pancreas	Pancreatic cancer	Q Exactive HF	Data-dependent acquisition	Spectrum counting	277	238	40904101	10.1002/pmic.70037	1	40904101	10.1002/pmic.70037	SLB-msSIM: A Spectral Library-Based Multiplex Segmented SIM Platform for Single-Cell Proteomic Analysis.	https://www.ebi.ac.uk/pride/archive/projects/PXD055915
PXD056327	sandbox_draft	sandbox/PXD056327/PXD056327.sdrf.tsv	Formaldehyde fixation helps preserve the proteome state during single-cell proteomics sample processing and analysis	single-cell proteomics;cellenONE;ProteoCHIP	single cell proteomics;single-cell proteomic;single-cell proteomics	Homo sapiens (human)	Cell culture; Hela cell		Orbitrap Astral	Data-independent acquisition; Bottom-up proteomics; Data-dependent acquisition	Label free; TMT	143	138	39901769	10.1021/acs.jproteome.4c00656	1	39901769	10.1021/acs.jproteome.4c00656	Formaldehyde Fixation Helps Preserve the Proteome State during Single-Cell Proteomics Sample Processing and Analysis.	https://www.ebi.ac.uk/pride/archive/projects/PXD056327
PXD057118	sandbox_draft	sandbox/PXD057118/PXD057118.sdrf.tsv	Deciphering functional tumor-immune crosstalk through highly multiplexed imaging and deep visual proteomics	deep visual proteomics	Deep Visual Proteomics	Homo sapiens (human)	Colon; Tonsil	Colon cancer; Tonsil cancer	timsTOF SCP; Orbitrap Astral	Bottom-up proteomics	label-free quantification; Dimethyl Labeling	18	1			1	40536875	10.1016/j.xpro.2025.103901	Protocol for spatial proteomic profiling of tonsil cancer microenvironments using multiplexed imaging-powered deep visual proteomics.	https://www.ebi.ac.uk/pride/archive/projects/PXD057118
PXD057685	sandbox_draft	sandbox/PXD057685/PXD057685.sdrf.tsv	Electrophoresis-Correlative Framing of Ion Mobility Deepens Single-Cell Mass Spectrometry Proteomics	single-cell proteome;single-cell mass spectrometry	single cell mass spectrometry;single cell proteome;single cell proteomics;single-cell mass spectrometry;single-cell proteome;single-cell proteomic;single-cell proteomics	Homo sapiens (human); Xenopus laevis (african clawed frog)	Cell culture		timsTOF	Bottom-up proteomics; Data-dependent acquisition		9	2	39674510	10.1016/j.mcpro.2024.100892	1	39674510	10.1016/j.mcpro.2024.100892	Electrophoresis-Correlative Ion Mobility Deepens Single-Cell Proteomics in Capillary Electrophoresis Mass Spectrometry.	https://www.ebi.ac.uk/pride/archive/projects/PXD057685
PXD058457	sandbox_draft	sandbox/PXD058457/PXD058457.sdrf.tsv	High throughput single-cell proteomics of in-vivo cells	single-cell proteomics;cellenONE	single cell proteomics;single-cell proteomic;single-cell proteomics	Homo sapiens (human); Mus musculus (mouse)	Macrophage; Cell culture; Lung	Colon cancer	timsTOF SCP	Data-independent acquisition; Bottom-up proteomics		21	1		10.1016/J.MCPRO.2025.101018	1	40544993	10.1016/j.mcpro.2025.101018	High-Throughput Single-Cell Proteomics of In Vivo Cells.	https://www.ebi.ac.uk/pride/archive/projects/PXD058457
PXD058753	sandbox_draft	sandbox/PXD058753/PXD058753.sdrf.tsv	Global analysis of protein turnover dynamics in single cells	single-cell proteomics	single cell proteomics;single-cell proteomic;single-cell proteomics	Homo sapiens (human)	Cell culture; Fibroblast		Orbitrap Astral	Data-independent acquisition; Bottom-up proteomics	SILAC	385	384			0				https://www.ebi.ac.uk/pride/archive/projects/PXD058753
PXD059079	sandbox_draft	sandbox/PXD059079/PXD059079.sdrf.tsv	Single-Cell Proteomic and Transcriptomic Characterization of Drug-Resistant Prostate Cancer Cells Reveals Molecular Signatures Associated with Morphological Changes	single-cell proteomics	single cell proteomics;single-cell proteomic;single-cell proteomics	Homo sapiens (human)	Epithelial cell of prostate	Prostate adenocarcinoma	Orbitrap Ascend; timsTOF HT	Bottom-up proteomics	label-free quantification; Data-independent acquisition	13	6		10.1016/J.MCPRO.2025.100949	1	40090465	10.1016/j.mcpro.2025.100949	Single-Cell Proteomic Characterization of Drug-Resistant Prostate Cancer Cells Reveals Molecular Signatures Associated with Morphological Changes.	https://www.ebi.ac.uk/pride/archive/projects/PXD059079
PXD059683	sandbox_draft	sandbox/PXD059683/PXD059683.sdrf.tsv	SpLICE: A reference database enabling in depth proteome and PTM analysis of mouse immune cells	single-cell proteomics;single-cell proteome	single cell proteome;single-cell proteome;single-cell proteomic	Mus musculus (mouse)	T cell; Macrophage; Dendritic cell; B cell; Cell culture		Q Exactive HF	Bottom-up proteomics; Data-dependent acquisition	Label free	73	60			1	40210874	10.1038/s41597-025-04829-9	A reference database enabling in-depth proteome and PTM analysis of mouse immune cells.	https://www.ebi.ac.uk/pride/archive/projects/PXD059683
PXD061065	sandbox_draft	sandbox/PXD061065/PXD061065.sdrf.tsv	Single cell proteomics of human brain neutrophils from glioblastoma patients	single-cell proteomics;single-cell proteome;cellenONE	single cell proteome;single cell proteomics;single-cell proteome;single-cell proteomic;single-cell proteomics	Homo sapiens (human)	Neutrophil; Brain	Glioblastoma	Orbitrap Astral	Data-independent acquisition	Relative quantification	351	342			1	41397978	10.1038/s41467-025-67367-3	Single cell proteomic analysis defines discrete neutrophil functional states in human glioblastoma.	https://www.ebi.ac.uk/pride/archive/projects/PXD061065
PXD061710	sandbox_draft	sandbox/PXD061710/PXD061710.sdrf.tsv	Overcoming preservation challenges to enable single-cell proteomics of fixed cell and tissue samples with retained proteome integrity	single-cell proteomics;single-cell proteome;cellenONE;ProteoCHIP	single cell proteome;single cell proteomics;single-cell proteome;single-cell proteomic;single-cell proteomics	Homo sapiens (human); Mus musculus (mouse)	Epithelial cell; Pancreas; Cell culture	Cancer	timsTOF SCP	Data-independent acquisition; Bottom-up proteomics	label-free quantification	22	1			0				https://www.ebi.ac.uk/pride/archive/projects/PXD061710
PXD062231	sandbox_draft	sandbox/PXD062231/PXD062231.sdrf.tsv	Single-cell spatial proteomics maps human liver zonation patterns and their vulnerability to disruption in tissue architecture	single-cell proteomics;deep visual proteomics	Deep Visual Proteomics;single cell proteomics;single-cell proteomic;single-cell proteomics	Homo sapiens (human)	Liver; Hepatocyte	Liver disease; Disease free	Orbitrap Astral	Data-independent acquisition; Bottom-up proteomics	label-free quantification	812	792			1	41721135	10.1038/s42255-026-01459-2	Single-cell spatial proteomics maps human liver zonation patterns and their vulnerability to disruption in tissue architecture.	https://www.ebi.ac.uk/pride/archive/projects/PXD062231
