accession	action	sdrf_path	title	evidence_terms	pride_queries	organisms	organism_parts	diseases	instruments	experiment_types	quantification_methods	file_count	draft_row_count	pride_pubmed_ids	pride_dois	europepmc_hit_count	europepmc_first_pmid	europepmc_first_doi	europepmc_first_title	pride_url
PXD062702	sandbox_draft	sandbox/PXD062702/PXD062702.sdrf.tsv	Live Electrophoresis-Correlative AI Democratizes Single-cell Mass Spectrometry Proteomics	single-cell proteomics;single-cell proteome;single-cell mass spectrometry	single cell mass spectrometry;single cell proteome;single cell proteomics;single-cell mass spectrometry;single-cell proteome;single-cell proteomic;single-cell proteomics	Homo sapiens (human); Xenopus laevis (african clawed frog)	Embryo; Early embryonic cell		Orbitrap Fusion Lumos; Q Exactive	Bottom-up proteomics	Relative quantification	52	43		10.1002/ANIE.202510692	0				https://www.ebi.ac.uk/pride/archive/projects/PXD062702
PXD063539	sandbox_draft	sandbox/PXD063539/PXD063539.sdrf.tsv	Spatial Proteomic Profiling Reveals Increased Levels of Cholesterol Synthesis Proteins in Psoriasis Vulgaris	deep visual proteomics	Deep Visual Proteomics	Homo sapiens (human)	Epithelial cell; Neutrophil; Keratinocyte; B cell; Dendritic cell; Fibroblast; Melanocyte; Leukocyte; Skin; Macrophage; T cell; Monocyte; Erythrocyte	Psoriasis	timsTOF SCP	Data-independent acquisition; Bottom-up proteomics; Data-dependent acquisition; diaPASEF	Relative quantification	15	1		10.1016/J.JID.2025.05.002	0				https://www.ebi.ac.uk/pride/archive/projects/PXD063539
PXD063590	sandbox_draft	sandbox/PXD063590/PXD063590.sdrf.tsv	Single cell proteomic analysis of human prefrontal cortex in Alzheimer's Disease	single-cell proteomics;nPOP;cellenONE	single cell proteomics;single-cell proteomic;single-cell proteomics	Homo sapiens (human)	Brain		Orbitrap Exploris 480	Bottom-up proteomics	TMT	92	89			0				https://www.ebi.ac.uk/pride/archive/projects/PXD063590
PXD064049	sandbox_draft	sandbox/PXD064049/PXD064049.sdrf.tsv	Extrachromosomal DNA-driven oncogene dosage heterogeneity promotes rapid adaptation to therapy in MYCN-amplified cancers	deep visual proteomics	Deep Visual Proteomics	Homo sapiens (human)	Malignant cell; Neuroblastoma cell line	Neuroblastoma	timsTOF SCP	Data-independent acquisition; Bottom-up proteomics	label-free quantification; Data-independent acquisition	5	1			1	40773595	10.1158/2159-8290.cd-24-1738	Extrachromosomal DNA-Driven Oncogene Dosage Heterogeneity Promotes Rapid Adaptation to Therapy in MYCN-Amplified Cancers.	https://www.ebi.ac.uk/pride/archive/projects/PXD064049
PXD064499	sandbox_draft	sandbox/PXD064499/PXD064499.sdrf.tsv	Pro-regenerative fingerprints identified in a sub-population of adult mouse cardiomyocytes by integrative single-cell proteomics-Pilot dataset	single-cell proteomics	single cell proteomics;single-cell proteomic;single-cell proteomics	Mus musculus (mouse)	Cardiac muscle cell; Heart		Orbitrap Eclipse	Data-dependent acquisition	TMT	36	24		10.6019/PXD064499	0				https://www.ebi.ac.uk/pride/archive/projects/PXD064499
PXD064501	sandbox_draft	sandbox/PXD064501/PXD064501.sdrf.tsv	Pro-regenerative fingerprints identified in a sub-population of adult mouse cardiomyocytes by integrative single-cell proteomics_FACS	single-cell proteomics;single-cell proteome	single cell proteome;single cell proteomics;single-cell proteome;single-cell proteomic;single-cell proteomics	Mus musculus (mouse)	Cardiac muscle cell; Heart		Orbitrap Eclipse	Data-dependent acquisition	TMT	42	28		10.6019/PXD064501	0				https://www.ebi.ac.uk/pride/archive/projects/PXD064501
PXD064518	sandbox_draft	sandbox/PXD064518/PXD064518.sdrf.tsv	Pro-regenerative fingerprints identified in a sub-population of adult mouse cardiomyocytes by integrative single-cell proteomics-Analytical dataset	single-cell proteomics;single-cell proteome	single cell proteome;single cell proteomics;single-cell proteome;single-cell proteomic;single-cell proteomics	Mus musculus (mouse)	Cardiac muscle cell; Heart		Orbitrap Eclipse	Data-dependent acquisition	TMT	243	162		10.6019/PXD064518	0				https://www.ebi.ac.uk/pride/archive/projects/PXD064518
PXD064564	sandbox_draft	sandbox/PXD064564/PXD064564.sdrf.tsv	Challenging the Astral mass analyzer  up to 5300 proteins per single-cell at unseen quantitative accuracy to study cellular heterogeneity.	single-cell proteomics;cellenONE	single cell proteomics;single-cell proteomic;single-cell proteomics	Homo sapiens (human)	Epithelial cell	Lung cancer	Orbitrap Astral	Data-independent acquisition; Bottom-up proteomics	label-free quantification	186	30	39820751	10.1038/s41592-024-02559-1	0				https://www.ebi.ac.uk/pride/archive/projects/PXD064564
PXD066993	sandbox_draft	sandbox/PXD066993/PXD066993.sdrf.tsv	Spatial omics of acute myocardial infarction reveals a novel mode of immune cell infiltration	deep visual proteomics	Deep Visual Proteomics	Mus musculus (mouse)	Myeloid cell; Endocardial cell; Cardiac muscle myoblast; Endothelial cell; Fibroblast of cardiac tissue; Heart	Myocardial infarction	timsTOF SCP	Data-independent acquisition; Bottom-up proteomics	Relative quantification	5	1			1	41044418	10.1038/s44161-025-00717-y	Spatial multiomics of acute myocardial infarction reveals immune cell infiltration through the endocardium.	https://www.ebi.ac.uk/pride/archive/projects/PXD066993
PXD067019	sandbox_draft	sandbox/PXD067019/PXD067019.sdrf.tsv	Fine-Tuning of Label-Free Single-Cell Proteomics Workflows	single-cell proteomics	single cell proteomics;single-cell proteomic;single-cell proteomics	Homo sapiens (human)	Permanent cell line cell; Cell culture	Cervix carcinoma	timsTOF Ultra 2	Bottom-up proteomics	Relative quantification	406	1			0				https://www.ebi.ac.uk/pride/archive/projects/PXD067019
PXD067623	sandbox_draft	sandbox/PXD067623/PXD067623.sdrf.tsv	Impact of intermittent lead exposure on hominid brain evolution	single-cell proteomics	single cell proteomics;single-cell proteomic;single-cell proteomics	Homo sapiens (human)	Brain		Orbitrap Astral	Bottom-up proteomics		227	226	41091888	10.1126/sciadv.adr1524	1	41091888	10.1126/sciadv.adr1524	Impact of intermittent lead exposure on hominid brain evolution.	https://www.ebi.ac.uk/pride/archive/projects/PXD067623
PXD069039	sandbox_draft	sandbox/PXD069039/PXD069039.sdrf.tsv	Multiplexed quantitation of post-translational modified peptides in single cells using triggered MS/MS combined with super heavy tandem mass tags	single-cell proteomics	single cell proteomics;single-cell proteomic;single-cell proteomics	Homo sapiens (human)			Q Exactive	Bottom-up proteomics	TMT	48	39	41348131	10.1007/s00425-025-04891-y	2	41632302	10.1007/s00425-026-04941-z	Correction: With or without a Ca&lt;sup&gt;2+&lt;/sup&gt; signal?: a proteomics approach toward Ca&lt;sup&gt;2+&lt;/sup&gt;dependent and independent changes in response to oxidative stress in Arabidopsis thaliana.	https://www.ebi.ac.uk/pride/archive/projects/PXD069039
PXD069335	sandbox_draft	sandbox/PXD069335/PXD069335.sdrf.tsv	Low-resolution FAIMS for increased peptide coverage in low-load and single-cell proteomics	single-cell proteomics	single cell proteomics;single-cell proteomic;single-cell proteomics	Homo sapiens (human)	Epithelial cell	Lung carcinoma	Orbitrap Astral	Data-independent acquisition; Bottom-up proteomics		158	125		10.1038/S41598-026-45228-3	0				https://www.ebi.ac.uk/pride/archive/projects/PXD069335
PXD069842	sandbox_draft	sandbox/PXD069842/PXD069842.sdrf.tsv	Colonic spatial single-cell proteomics and murine models link mitochondrial dysfunction to dimeric IgA-secreting plasma cell deficiency in Crohn's disease	single-cell proteomics	single cell proteomics;single-cell proteomic;single-cell proteomics	Homo sapiens (human)	Blood plasma		timsTOF HT	Data-independent acquisition	Relative quantification	43	1	41680132	10.1038/s41467-026-69069-w	1	41680132	10.1038/s41467-026-69069-w	Colonic spatial single-cell proteomics and murine models link mitochondrial dysfunction to dimeric IgA-secreting plasma cell deficiency in Crohn's disease.	https://www.ebi.ac.uk/pride/archive/projects/PXD069842
PXD069898	sandbox_draft	sandbox/PXD069898/PXD069898.sdrf.tsv	Spectral Cruncher: A Visualization Tool Integrating Manual Curation, Ion-Intensity Prediction, and De Novo Tag Generation	single-cell proteomics;cellenONE	single cell proteomics;single-cell proteomic;single-cell proteomics	Homo sapiens (human); Mus musculus (mouse)			Orbitrap Astral	Data-dependent acquisition		21	14	41459773	10.1021/jasms.5c00301	1	41459773	10.1021/jasms.5c00301	Spectral Cruncher: A Visualization Tool Integrating Manual Curation, Ion-Intensity Prediction, and De Novo Tag Generation.	https://www.ebi.ac.uk/pride/archive/projects/PXD069898
PXD070049	sandbox_draft	sandbox/PXD070049/PXD070049.sdrf.tsv	LFQ Benchmark Dataset - Generation Beta: Assessing Modern Proteomics Instruments and Acquisition Workflows with High-Throughput LC Gradients	single-cell proteomics	single cell proteomics;single-cell proteomic;single-cell proteomics	Saccharomyces cerevisiae (baker's yeast); Escherichia coli; Homo sapiens (human)			timsTOF Ultra 2; ZenoTOF 7600+; Orbitrap Astral; ZenoTOF 8600; timsTOF Ultra	SWATH MS; All-ion fragmentation; Data-independent acquisition; Bottom-up proteomics; Data-dependent acquisition; diaPASEF	Relative quantification	2174	1049		10.64898/2026.01.29.702266	1			Carafe2 enables high quality in silico spectral library generation for timsTOF data-independent acquisition proteomics	https://www.ebi.ac.uk/pride/archive/projects/PXD070049
PXD070495	sandbox_draft	sandbox/PXD070495/PXD070495.sdrf.tsv	Deep visual proteomics uncovers nociceptor diversity and pain targets	deep visual proteomics	Deep Visual Proteomics	Mus musculus (mouse)	Pain receptor cell; Mechanoreceptor cell; Neuron; Electrically active cell		timsTOF SCP; timsTOF Ultra	Bottom-up proteomics	label-free quantification	11	3		10.1038/S41467-026-71418-8	2	41965357	10.1038/s41467-026-71418-8	Deep visual proteomics uncovers nociceptor diversity and pain targets.	https://www.ebi.ac.uk/pride/archive/projects/PXD070495
PXD071075	sandbox_draft	sandbox/PXD071075/PXD071075.sdrf.tsv	Single-cell proteomic landscape of the developing human brain	single-cell proteomics;single-cell proteome	single cell proteome;single-cell proteome;single-cell proteomic	Homo sapiens (human)	Brain		Orbitrap Eclipse	Data-independent acquisition; Bottom-up proteomics		2313	2310			0				https://www.ebi.ac.uk/pride/archive/projects/PXD071075
PXD071205	sandbox_draft	sandbox/PXD071205/PXD071205.sdrf.tsv	LFQ Benchmark Dataset - Generation Beta: Assessing Modern Proteomics Instruments and Acquisition Workflows with High-Throughput LC Gradients - Optimized Astral dataset	single-cell proteomics	single cell proteomics;single-cell proteomic;single-cell proteomics	Saccharomyces cerevisiae (baker's yeast); Escherichia coli; Homo sapiens (human)			Orbitrap Astral	All-ion fragmentation; Data-independent acquisition; Bottom-up proteomics		86	83			0				https://www.ebi.ac.uk/pride/archive/projects/PXD071205
PXD072559	sandbox_draft	sandbox/PXD072559/PXD072559.sdrf.tsv	AI-powered Deep Visual Proteomics unmasks critical molecular transitions in pancreatic cancer precursors	deep visual proteomics	Deep Visual Proteomics	Homo sapiens (human)	Panin cell; Epithelium of pancreatic duct; Malignant cell; Pancreatic duct; Pancreatic ductal adenocarcinoma cell	Pancreatic ductal adenocarcinoma	Orbitrap Astral	Bottom-up proteomics	label-free quantification	5	1			0				https://www.ebi.ac.uk/pride/archive/projects/PXD072559
PXD073018	sandbox_draft	sandbox/PXD073018/PXD073018.sdrf.tsv	Treatment of human oocytes with extracellular vesicles from follicular fluid during rescue in vitro maturation enhances maturation rates and modulates oocyte proteome and ultrastructure	single-cell proteomics	single-cell proteomic	Homo sapiens (human)	Follicular fluid; Oocyte; Oocyte		Orbitrap Fusion Lumos; timsTOF Pro	Bottom-up proteomics; Data-dependent acquisition; diaPASEF	Relative quantification	35	21	41924634	10.1093/hropen/hoag021	1	41924634	10.1093/hropen/hoag021	Treatment of human oocytes with extracellular vesicles from follicular fluid during rescue &lt;i&gt;in vitro&lt;/i&gt; maturation enhances maturation rates and modulates oocyte proteome and ultrastructure.	https://www.ebi.ac.uk/pride/archive/projects/PXD073018
PXD073405	sandbox_draft	sandbox/PXD073405/PXD073405.sdrf.tsv	Multiplexed quantitation of post-translational modified peptides in single cells using triggered MS/MS combined with super heavy tandem mass tags	single-cell proteomics	single cell proteomics;single-cell proteomic;single-cell proteomics	Homo sapiens (human)			Orbitrap Exploris 480	SRM/MRM; Bottom-up proteomics	TMT	57	46	41591392	10.1021/acs.jproteome.5c00972	0				https://www.ebi.ac.uk/pride/archive/projects/PXD073405
